uuid,paper_id,title,paper_link,doi,download_link,code,reason
c03c061c-31ff-4dee-9ac5-6665bc12a3a8,5bf6f01402e1648b7d1e6c9200ede6cb1af30123,Probabilistic reasoning in intelligent systems,https://www.semanticscholar.org/paper/5bf6f01402e1648b7d1e6c9200ede6cb1af30123,https://doi.org/10.1016/c2009-0-27609-4,http://www.researchandmarkets.com/reports/1769924/probabilistic_reasoning_in_intelligent_systems.pdf,,local variable 'e' referenced before assignment
9a6daed8-6f5c-4a30-8088-e3f1cf03b7bd,61af1deb7a3016cd0760aca0f0a38a4fecda3d61,Models for retrieval with probabilistic indexing,https://www.semanticscholar.org/paper/61af1deb7a3016cd0760aca0f0a38a4fecda3d61,https://doi.org/10.1016/0306-4573%2889%2990091-5,http://ctp.di.fct.unl.pt/~jmag/wamse/papers/1989.Models%20for%20retrieval%20with%20probabilistic%20indexing.pdf,,"HTTPConnectionPool(host='ctp.di.fct.unl.pt', port=80): Max retries exceeded with url: /~jmag/wamse/papers/1989.Models%20for%20retrieval%20with%20probabilistic%20indexing.pdf (Caused by ResponseError('too many 403 error responses'))"
f504aa1c-7814-4dc8-b276-72eb1736c434,70ef29e6f0ce082bb8a47fd85b9bfb7cc0f20c93,Probabilistic reasoning in intelligent systems - networks of plausible inference,https://www.semanticscholar.org/paper/70ef29e6f0ce082bb8a47fd85b9bfb7cc0f20c93,https://doi.org/10.2307/2026705,http://scis.nova.edu/~adnan/research/reviews/Probabilistic%20Reasoning%20in%20Intelligent%20Systems%20by%20Judea%20Pearl.pdf,,"HTTPConnectionPool(host='scis.nova.edu', port=80): Max retries exceeded with url: /~adnan/research/reviews/Probabilistic%20Reasoning%20in%20Intelligent%20Systems%20by%20Judea%20Pearl.pdf (Caused by ResponseError('too many 403 error responses'))"
654011b5-8e23-49c1-9821-28f88c118b30,e50db98e322eb525a6306bc1b6049fa98c58e024,Boolean interpretation of conjunctions for document retrieval,https://www.semanticscholar.org/paper/e50db98e322eb525a6306bc1b6049fa98c58e024,https://doi.org/10.1002/%28SICI%291097-4571%28198707%2938%3A4%253C245%3A%3AAID-ASI5%253E3.0.CO%3B2-E,https://zero.sci-hub.st/5/b8ebe04c302fdc79b76e56f98b351adb/das-gupta1987.pdf#navpanes=0&view=FitH,,local variable 'e' referenced before assignment
211160a6-d82f-44dd-b8e4-3995002c6e29,36be1952b5fca941045e4fc992a38293ee798e29,Asynchronous design/evaluation methods for hypertext technology development,https://www.semanticscholar.org/paper/36be1952b5fca941045e4fc992a38293ee798e29,https://doi.org/10.1145/74224.74230,http://people.ischool.berkeley.edu/~glushko/glushko_files/SevenWaysToFail.pdf;http://www.researchgate.net/profile/Gary_Perlman/publication/221267338_Asynchronous_DesignEvaluation_Methods_for_Hypertext_Technology_Development/links/00b49537e776b0063c000000.pdf,,local variable 'e' referenced before assignment
211160a6-d82f-44dd-b8e4-3995002c6e29,36be1952b5fca941045e4fc992a38293ee798e29,Asynchronous design/evaluation methods for hypertext technology development,https://www.semanticscholar.org/paper/36be1952b5fca941045e4fc992a38293ee798e29,https://doi.org/10.1145/74224.74230,http://people.ischool.berkeley.edu/~glushko/glushko_files/SevenWaysToFail.pdf;http://www.researchgate.net/profile/Gary_Perlman/publication/221267338_Asynchronous_DesignEvaluation_Methods_for_Hypertext_Technology_Development/links/00b49537e776b0063c000000.pdf,,"HTTPSConnectionPool(host='www.researchgate.net', port=443): Max retries exceeded with url: /profile/Gary_Perlman/publication/221267338_Asynchronous_DesignEvaluation_Methods_for_Hypertext_Technology_Development/links/00b49537e776b0063c000000.pdf (Caused by ResponseError('too many 403 error responses'))"
a192e1d1-d7df-4121-a143-4ad596f645b0,47dd1a3e3a879f8a533b885933c8aaf29d54c42a,Dissemination of collection wide information in a distributed information retrieval system,https://www.semanticscholar.org/paper/47dd1a3e3a879f8a533b885933c8aaf29d54c42a,https://doi.org/10.1145/215206.215327,http://www.cs.virginia.edu/~cyberia/posters/sigir95.pdf,,local variable 'e' referenced before assignment
7989293e-4606-4209-8379-8360f78dd061,b55e936fb0434049ce8059604be7dd13b6ee3d55,The MG retrieval system: compressing for space and speed,https://www.semanticscholar.org/paper/b55e936fb0434049ce8059604be7dd13b6ee3d55,https://doi.org/10.1145/205323.205327,http://www.researchgate.net/profile/Ian_Witten/publication/47400200_The_MG_retrieval_system_compressing_for_space_and_speed/links/00b495175e36ca961d000000.pdf,,"HTTPSConnectionPool(host='www.researchgate.net', port=443): Max retries exceeded with url: /profile/Ian_Witten/publication/47400200_The_MG_retrieval_system_compressing_for_space_and_speed/links/00b495175e36ca961d000000.pdf (Caused by ResponseError('too many 403 error responses'))"
8380baba-a9e7-4b73-b99a-d09e0e91955c,cc24a311101279d7b41e0fe4549d0b940d1d4531,Learning collection fusion strategies,https://www.semanticscholar.org/paper/cc24a311101279d7b41e0fe4549d0b940d1d4531,https://doi.org/10.1145/215206.215357,http://www.researchgate.net/profile/Narendra_Gupta6/publication/221300563_Learning_Collection_Fusion_Strategies/links/09e4150eed5b6aadb4000000.pdf,,"HTTPSConnectionPool(host='www.researchgate.net', port=443): Max retries exceeded with url: /profile/Narendra_Gupta6/publication/221300563_Learning_Collection_Fusion_Strategies/links/09e4150eed5b6aadb4000000.pdf (Caused by ResponseError('too many 403 error responses'))"
637ebe19-bb74-492e-85ae-5ee65891ecf3,6ee8e77e128d07b9d59124cb747181783b8f1bf9,Effects of Search Experience and Subject Knowledge on the Search Tactics of Novice and Experienced Searchers,https://www.semanticscholar.org/paper/6ee8e77e128d07b9d59124cb747181783b8f1bf9,https://doi.org/10.1002/%28SICI%291097-4571%28199304%2944%3A3%253C161%3A%3AAID-ASI5%253E3.0.CO%3B2-8,https://zero.sci-hub.st/5/5036d0863d83c21c3558cfe7ce2f336f/hsieh-yee1993.pdf#navpanes=0&view=FitH,,local variable 'e' referenced before assignment
63069a73-b87f-4340-b47e-2368a4a1d892,847c6817b3b2f5a1571f3dc179c3b3cbb83d9dad,Determining the functionality features of an intelligent interface to an information retrieval system,https://www.semanticscholar.org/paper/847c6817b3b2f5a1571f3dc179c3b3cbb83d9dad,https://doi.org/10.1145/96749.98901,http://www.researchgate.net/profile/Nicholas_Belkin/publication/221300263_Determining_the_Functionality_and_Features_of_an_Intelligent_Interface_to_an_Information_Retrieval_System/links/0deec51893e66ef1ca000000.pdf,,"HTTPSConnectionPool(host='www.researchgate.net', port=443): Max retries exceeded with url: /profile/Nicholas_Belkin/publication/221300263_Determining_the_Functionality_and_Features_of_an_Intelligent_Interface_to_an_Information_Retrieval_System/links/0deec51893e66ef1ca000000.pdf (Caused by ResponseError('too many 403 error responses'))"
1cf7e7e1-dad9-425a-9297-ece6e8e7fb97,c2075c00175d6a36abfb10c607c32291364b1e48,The design and evaluation of a front-end user interface for energy researchers,https://www.semanticscholar.org/paper/c2075c00175d6a36abfb10c607c32291364b1e48,https://doi.org/10.1002/%28SICI%291097-4571%28198903%2940%3A2%253C99%3A%3AAID-ASI4%253E3.0.CO%3B2-7,https://zero.sci-hub.st/5/f7ceb8f9bbfa683dbc822bb31d225436/borgman1989.pdf#navpanes=0&view=FitH,,local variable 'e' referenced before assignment
bffd780c-a547-4eb5-a6df-9fddc3bd03ff,00ea6408abab612f2166ab91e4628dbfbad71a7f,Cluster analysis for hypertext systems,https://www.semanticscholar.org/paper/00ea6408abab612f2166ab91e4628dbfbad71a7f,https://doi.org/10.1145/160688.160704,https://www.researchgate.net/profile/Rodrigo_Botafogo/publication/221299137_Cluster_Analysis_for_Hypertext_Systems/links/0c96051e9e2215937c000000.pdf,,"HTTPSConnectionPool(host='www.researchgate.net', port=443): Max retries exceeded with url: /profile/Rodrigo_Botafogo/publication/221299137_Cluster_Analysis_for_Hypertext_Systems/links/0c96051e9e2215937c000000.pdf (Caused by ResponseError('too many 403 error responses'))"
21578161-25a2-4394-b6de-9242a760af39,18f96ef4398bb3893706c8e42d944a7108dbcb91,The Alchemy System for Statistical Relational AI: User Manual,https://www.semanticscholar.org/paper/18f96ef4398bb3893706c8e42d944a7108dbcb91,,http://wiki.ict.usc.edu/cogarch/images/3/3e/Manual.pdf,,"HTTPConnectionPool(host='wiki.ict.usc.edu', port=80): Max retries exceeded with url: /cogarch/images/3/3e/Manual.pdf (Caused by ConnectTimeoutError(<urllib3.connection.HTTPConnection object at 0x0000018CB17B5E70>, 'Connection to wiki.ict.usc.edu timed out. (connect timeout=30)'))"
8c54063a-51f3-4b6e-9f62-c5834cc92b84,3b76b68c44e4d9f875e2aaa95eae689bbc67396c,Statistical schema matching across web query interfaces,https://www.semanticscholar.org/paper/3b76b68c44e4d9f875e2aaa95eae689bbc67396c,https://doi.org/10.1145/872757.872784,http://forward.cs.illinois.edu/pubs/2003/unifiedschema-sigmod2003-hc-mar2003.pdf;http://www-forward.cs.uiuc.edu/pubs/2003/unifiedschema-sigmod03-hc-mar03.pdf,,"HTTPConnectionPool(host='forward.cs.illinois.edu', port=80): Max retries exceeded with url: /pubs/2003/unifiedschema-sigmod2003-hc-mar2003.pdf (Caused by NewConnectionError('<urllib3.connection.HTTPConnection object at 0x0000018CB17B6A70>: Failed to establish a new connection: [Errno 11001] getaddrinfo failed'))"
8c54063a-51f3-4b6e-9f62-c5834cc92b84,3b76b68c44e4d9f875e2aaa95eae689bbc67396c,Statistical schema matching across web query interfaces,https://www.semanticscholar.org/paper/3b76b68c44e4d9f875e2aaa95eae689bbc67396c,https://doi.org/10.1145/872757.872784,http://forward.cs.illinois.edu/pubs/2003/unifiedschema-sigmod2003-hc-mar2003.pdf;http://www-forward.cs.uiuc.edu/pubs/2003/unifiedschema-sigmod03-hc-mar03.pdf,,"HTTPConnectionPool(host='www-forward.cs.uiuc.edu', port=80): Max retries exceeded with url: /pubs/2003/unifiedschema-sigmod03-hc-mar03.pdf (Caused by NewConnectionError('<urllib3.connection.HTTPConnection object at 0x0000018CB35B5AB0>: Failed to establish a new connection: [Errno 11001] getaddrinfo failed'))"
c0d1c6bf-b088-433f-9d4c-2b9ec953507b,52ddb78de50f0716b4ddc485016d3d236e682381,Learning Taxonomic Relations from Heterogeneous Sources of Evidence,https://www.semanticscholar.org/paper/52ddb78de50f0716b4ddc485016d3d236e682381,,http://userpages.uni-koblenz.de/~staab/Research/Publications/2005/OL-book-chapter-cimiano.pdf,,local variable 'e' referenced before assignment
5b2bf1f8-b4a2-40ed-8319-ec2cf3832b5a,22ea035da318c728015400551ad642160e1a23a9,How effective is suffixing?,https://www.semanticscholar.org/paper/22ea035da318c728015400551ad642160e1a23a9,https://doi.org/10.1002/%28SICI%291097-4571%28199101%2942%3A1%253C7%3A%3AAID-ASI2%253E3.0.CO%3B2-P,https://www.cs.vassar.edu/~cs366/reading/week3/Harman%201991.pdf,,local variable 'e' referenced before assignment
d9763206-cf28-49fb-aaac-f5b1b16f14ef,c564a2ace7e2918f636991e7c76169e7360dd78e,Stemming of French Words Based on Grammatical Categories,https://www.semanticscholar.org/paper/c564a2ace7e2918f636991e7c76169e7360dd78e,https://doi.org/10.1002/%28SICI%291097-4571%28199301%2944%3A1%253C1%3A%3AAID-ASI1%253E3.0.CO%3B2-1,http://www.researchgate.net/profile/Jacques_Savoy/publication/220433508_Stemming_of_French_Words_Based_on_Grammatical_Categories/links/0deec52f8813b2da1c000000.pdf,,"HTTPSConnectionPool(host='www.researchgate.net', port=443): Max retries exceeded with url: /profile/Jacques_Savoy/publication/220433508_Stemming_of_French_Words_Based_on_Grammatical_Categories/links/0deec52f8813b2da1c000000.pdf (Caused by ResponseError('too many 403 error responses'))"
e4ddc3fb-3914-47f8-a9c8-cf2c043d8b91,19ba30993a6080affb58adfaf721bbfec90d9247,Words and rules,https://www.semanticscholar.org/paper/19ba30993a6080affb58adfaf721bbfec90d9247,https://doi.org/10.1016/S0024-3841%2898%2900035-7,http://pinker.wjh.harvard.edu/articles/papers/Edinburgh.pdf,,"HTTPConnectionPool(host='pinker.wjh.harvard.edu', port=80): Max retries exceeded with url: /articles/papers/Edinburgh.pdf (Caused by NewConnectionError('<urllib3.connection.HTTPConnection object at 0x0000018CB35B4E20>: Failed to establish a new connection: [Errno 11001] getaddrinfo failed'))"
355cac20-7357-4782-875d-58d0a4b2a36e,530ce619535a79a075bd889139864fb0709dc304,Shouldnt it be breakfunch? A quantitative analysis of blend structure in English,https://www.semanticscholar.org/paper/530ce619535a79a075bd889139864fb0709dc304,https://doi.org/10.1515/LING.2004.021,http://www.linguistics.ucsb.edu/faculty/stgries/research/2004_STG_Blends_Linguistics.pdf,,local variable 'e' referenced before assignment
490d79e6-0bb9-4eb6-a923-a476650abb86,b02dc84d6ddaa87378ddd4ac74161a150e386583,Abbreviations and Acronyms in English Word-Formation,https://www.semanticscholar.org/paper/b02dc84d6ddaa87378ddd4ac74161a150e386583,https://doi.org/10.2307/455038,http://cslu.ogi.edu/~sproatr/Courses/TextNorm/Papers/cannon.pdf,,"HTTPConnectionPool(host='cslu.ogi.edu', port=80): Max retries exceeded with url: /~sproatr/Courses/TextNorm/Papers/cannon.pdf (Caused by NewConnectionError('<urllib3.connection.HTTPConnection object at 0x0000018CB17B40A0>: Failed to establish a new connection: [Errno 11001] getaddrinfo failed'))"
6386750a-8b52-468b-898f-808841279b95,3a3f02dac5fc83e8a75eeff80b2f12697b6dfe3d,Communities of Practice: The Organizational Frontier,https://www.semanticscholar.org/paper/3a3f02dac5fc83e8a75eeff80b2f12697b6dfe3d,,http://www.rareplanet.org/sites/rareplanet.org/files/Communities_of_Practice__The_Organizational_Frontier%5B1%5D.pdf,,"HTTPConnectionPool(host='www.rareplanet.org', port=80): Max retries exceeded with url: /sites/rareplanet.org/files/Communities_of_Practice__The_Organizational_Frontier%5B1%5D.pdf (Caused by ConnectTimeoutError(<urllib3.connection.HTTPConnection object at 0x0000018CB5E34130>, 'Connection to www.rareplanet.org timed out. (connect timeout=30)'))"
22155b7b-1dec-4928-9de3-c3fb8f8b6fbd,07b57c99dc896fcae6e1598fb3e5b730a1aa48b2,Prognostic value of predischarge dobutamine stress echocardiography in chest pain patients with a negative cardiac troponin T.,https://www.semanticscholar.org/paper/07b57c99dc896fcae6e1598fb3e5b730a1aa48b2,https://doi.org/10.1016/S0735-1097%2802%2902897-8,http://www.onlinejacc.org/content/accj/41/4/596.full.pdf,,local variable 'e' referenced before assignment
eca9d07b-3fe6-428a-ba73-ec35ec62879f,3d247b705e6ffccccba5e2f937458eff468a22f9,"Interactive Internet search: keyword, directory and query reformulation mechanisms compared",https://www.semanticscholar.org/paper/3d247b705e6ffccccba5e2f937458eff468a22f9,https://doi.org/10.1145/345508.345598,http://mall.psy.ohio-state.edu/SIGIR2000.pdf,,"HTTPConnectionPool(host='mall.psy.ohio-state.edu', port=80): Max retries exceeded with url: /SIGIR2000.pdf (Caused by ConnectTimeoutError(<urllib3.connection.HTTPConnection object at 0x0000018CB17B69B0>, 'Connection to mall.psy.ohio-state.edu timed out. (connect timeout=30)'))"
bd8ab7d9-3a8d-420f-bc7e-ae9ba4caae38,fa4fac1e42c402c093ddcabe9653adaaf2eb2449,Semi-Supervised Regression with Co-Training Style Algorithms,https://www.semanticscholar.org/paper/fa4fac1e42c402c093ddcabe9653adaaf2eb2449,,http://cs.nju.edu.cn/lim/publications/tkde07.pdf,,local variable 'e' referenced before assignment
24b11d65-8049-431b-99ba-4a905d40e88c,4f7b934c676082b9b5b67055432c9ce666da0188,Body mass of late Quaternary mammals,https://www.semanticscholar.org/paper/4f7b934c676082b9b5b67055432c9ce666da0188,https://doi.org/10.1890/02-9003,http://biology.unm.edu/jhbrown/Documents/Publications/2000s/SmithEtAl2003E.pdf,,local variable 'e' referenced before assignment
e8ee46e4-7a49-4472-8950-a382f926eda1,e1687c574e5f0c972003d60a92e54afe7c780409,All of Statistics: a Concise Course in Statistical Inference,https://www.semanticscholar.org/paper/e1687c574e5f0c972003d60a92e54afe7c780409,https://doi.org/10.1111/J.1467-985X.2004.00347_18.X,http://www.bioinfo.org.cn/~wangchao/maa/w.statistic.pdf,,"HTTPConnectionPool(host='www.bioinfo.org.cn', port=80): Max retries exceeded with url: /~wangchao/maa/w.statistic.pdf (Caused by NewConnectionError('<urllib3.connection.HTTPConnection object at 0x0000018CB5E4B430>: Failed to establish a new connection: [Errno 11002] getaddrinfo failed'))"
e77e246a-9b5f-4e08-94e8-f9b827850866,eb83ab16c34668bad65cbf47ad8f6bd6f051b830,On the bias of traceroute sampling,https://www.semanticscholar.org/paper/eb83ab16c34668bad65cbf47ad8f6bd6f051b830,,http://jessica2.msri.org/attachments/10922/10922.pdf,,"HTTPConnectionPool(host='jessica2.msri.org', port=80): Max retries exceeded with url: /attachments/10922/10922.pdf (Caused by ConnectTimeoutError(<urllib3.connection.HTTPConnection object at 0x0000018CB5E4BB50>, 'Connection to jessica2.msri.org timed out. (connect timeout=30)'))"
84d3d4fa-7883-480f-9ae0-c8201c8bfc10,ed3b54d37c91ccaf7b059e217d1c91deab042e71,Physical Review Letters,https://www.semanticscholar.org/paper/ed3b54d37c91ccaf7b059e217d1c91deab042e71,,http://www.hep.princeton.edu/~mcdonald/examples/EP/fazzini_prl_1_247_58.pdf,,local variable 'e' referenced before assignment
ba0a7c1b-3d5b-4fb4-9975-e011d514001a,01c110a02836005b3c4a85f8c5bc5655d4aabeb2,Text categorization with many redundant features: using aggressive feature selection to make SVMs competitive with C4.5,https://www.semanticscholar.org/paper/01c110a02836005b3c4a85f8c5bc5655d4aabeb2,https://doi.org/10.1145/1015330.1015388,http://machinelearning.wustl.edu/mlpapers/paper_files/icml2004_GabrilovichM04.pdf;http://www.cs.technion.ac.il/~gabr/papers/fs-svm.pdf,,local variable 'e' referenced before assignment
ba0a7c1b-3d5b-4fb4-9975-e011d514001a,01c110a02836005b3c4a85f8c5bc5655d4aabeb2,Text categorization with many redundant features: using aggressive feature selection to make SVMs competitive with C4.5,https://www.semanticscholar.org/paper/01c110a02836005b3c4a85f8c5bc5655d4aabeb2,https://doi.org/10.1145/1015330.1015388,http://machinelearning.wustl.edu/mlpapers/paper_files/icml2004_GabrilovichM04.pdf;http://www.cs.technion.ac.il/~gabr/papers/fs-svm.pdf,,local variable 'e' referenced before assignment
d8ab3a2b-a712-4df2-b765-3016020e159d,29b21ed1477015ee6d7808d847582d6675ab70e2,In Wikipedia the Free Encyclopedia,https://www.semanticscholar.org/paper/29b21ed1477015ee6d7808d847582d6675ab70e2,,http://www.cvarc.org/tech/cellular_security/4G-Wikipedia.pdf,,local variable 'e' referenced before assignment
f805d942-889d-484a-87b2-e3a0761d602f,7c714989e5c3b05794dd3c394b582906a67dc2b4,Interaction of Feature Selection Methods and Linear Classification Models,https://www.semanticscholar.org/paper/7c714989e5c3b05794dd3c394b582906a67dc2b4,,http://ailab.ijs.si/dunja/TextML02/papers/Brank.pdf,,local variable 'e' referenced before assignment
6928c3cf-8520-47bc-9c6b-f614fc4a5560,aa2dd9dacde39a575b09bfaee3572bff396760bf,Comparison of Human and Latent Semantic Analysis (LSA) Judgements of Pairwise Document Similarities for a News Corpus,https://www.semanticscholar.org/paper/aa2dd9dacde39a575b09bfaee3572bff396760bf,,http://www.dtic.mil/dtic/tr/fulltext/u2/a427585.pdf,,"HTTPConnectionPool(host='www.dtic.mil', port=80): Max retries exceeded with url: /dtic/tr/fulltext/u2/a427585.pdf (Caused by ConnectTimeoutError(<urllib3.connection.HTTPConnection object at 0x0000018CB35B7040>, 'Connection to www.dtic.mil timed out. (connect timeout=30)'))"
dc374145-dd93-46ac-96c1-0c28a4c2783c,2f03f4d3b5caf2151343de3f2f947d90da0cdf89,Using BLAST for identifying gene and protein names in journal articles.,https://www.semanticscholar.org/paper/2f03f4d3b5caf2151343de3f2f947d90da0cdf89,https://doi.org/10.1016/S0378-1119%2800%2900431-5,http://compbio.ucdenver.edu/Hunter_lab/Cohen/usingBLASTforIdentifyingGeneAndProteinNames.pdf,,"HTTPConnectionPool(host='compbio.ucdenver.edu', port=80): Max retries exceeded with url: /Hunter_lab/Cohen/usingBLASTforIdentifyingGeneAndProteinNames.pdf (Caused by ConnectTimeoutError(<urllib3.connection.HTTPConnection object at 0x0000018CB17B75E0>, 'Connection to compbio.ucdenver.edu timed out. (connect timeout=30)'))"
ba76a141-09a4-42e7-b8d3-fd062323f6b8,608d05ed82782a37dde41e97d7da6a9fa4bb53f2,A literature network of human genes for high-throughput analysis of gene expression,https://www.semanticscholar.org/paper/608d05ed82782a37dde41e97d7da6a9fa4bb53f2,https://doi.org/10.1038/ng0501-21,http://www.idi.ntnu.no/grupper/su/publ/phd/jenssen-thesis/paper1-ng-v28-p21.pdf,,local variable 'e' referenced before assignment
8d9259e5-a4b3-4c01-849e-d9b74f927820,739d05138436b86838b48d24df48ff84e6c4234a,A study of abbreviations in MEDLINE abstracts,https://www.semanticscholar.org/paper/739d05138436b86838b48d24df48ff84e6c4234a,,http://www.lhncbc.nlm.nih.gov/files/archive/pub2002051.pdf;https://lhncbc.nlm.nih.gov/files/archive/pub2002051.pdf,,"HTTPSConnectionPool(host='www.lhncbc.nlm.nih.gov', port=443): Max retries exceeded with url: /files/archive/pub2002051.pdf (Caused by ResponseError('too many 403 error responses'))"
8d9259e5-a4b3-4c01-849e-d9b74f927820,739d05138436b86838b48d24df48ff84e6c4234a,A study of abbreviations in MEDLINE abstracts,https://www.semanticscholar.org/paper/739d05138436b86838b48d24df48ff84e6c4234a,,http://www.lhncbc.nlm.nih.gov/files/archive/pub2002051.pdf;https://lhncbc.nlm.nih.gov/files/archive/pub2002051.pdf,,"HTTPSConnectionPool(host='lhncbc.nlm.nih.gov', port=443): Max retries exceeded with url: /files/archive/pub2002051.pdf (Caused by ResponseError('too many 403 error responses'))"
35492a74-0e5f-496a-b748-0e97d3b97b24,840d1e3901351215fb892a45aa00417e71d216d2,Automatic Extraction of Acronyms from Text,https://www.semanticscholar.org/paper/840d1e3901351215fb892a45aa00417e71d216d2,https://doi.org/10.26686/wgtn.12922298,http://cslu.ogi.edu/~sproatr/Courses/TextNorm/Papers/yeates.pdf,,"HTTPConnectionPool(host='cslu.ogi.edu', port=80): Max retries exceeded with url: /~sproatr/Courses/TextNorm/Papers/yeates.pdf (Caused by NewConnectionError('<urllib3.connection.HTTPConnection object at 0x0000018CB5E48730>: Failed to establish a new connection: [Errno 11001] getaddrinfo failed'))"
c3d0b9df-b929-4b0f-a613-110594c4e204,c6583a6999752c90a1a5c34bf3ec557bab17b921,Disambiguating Ambiguous Biomedical Terms in Biomedical Narrative Text: An Unsupervised Method,https://www.semanticscholar.org/paper/c6583a6999752c90a1a5c34bf3ec557bab17b921,https://doi.org/10.1006/JBIN.2001.1023,http://www.researchgate.net/profile/Hongfang_Liu/publication/220388523_Disambiguating_Ambiguous_Biomedical_Terms_in_Biomedical_Narrative_Text_An_Unsupervised_Method/links/0c960526af22f8b0dc000000.pdf,,"HTTPSConnectionPool(host='www.researchgate.net', port=443): Max retries exceeded with url: /profile/Hongfang_Liu/publication/220388523_Disambiguating_Ambiguous_Biomedical_Terms_in_Biomedical_Narrative_Text_An_Unsupervised_Method/links/0c960526af22f8b0dc000000.pdf (Caused by ResponseError('too many 403 error responses'))"
b48fed1b-36b4-4d33-854a-e7a3702f98bb,1be693d9792c7f0dbe4782b2c6b40186b12bc95d,Why Words and Co-Words Cannot Map the Development of the Sciences,https://www.semanticscholar.org/paper/1be693d9792c7f0dbe4782b2c6b40186b12bc95d,https://doi.org/10.1002/%28SICI%291097-4571%28199705%2948%3A5%253C418%3A%3AAID-ASI4%253E3.0.CO%3B2-Y,https://zero.sci-hub.st/5/2010565d4b1b527254e9fa0c309c95bc/leydesdorff1997.pdf#navpanes=0&view=FitH,,local variable 'e' referenced before assignment
c3ee1deb-3d38-4cd6-8d56-108833ef71be,7da07348d6fcb2b292da76285f3a371b02b8296b,Mercer kernel-based clustering in feature space,https://www.semanticscholar.org/paper/7da07348d6fcb2b292da76285f3a371b02b8296b,https://doi.org/10.1109/TNN.2002.1000150,http://www.dcs.gla.ac.uk/publications/PAPERS/7385/kern_km.pdf,,local variable 'e' referenced before assignment
71e766a5-e4f8-44b6-8eb3-ca69953bd7e2,d7d385f45c096082812deb1623e5af2c2915b4a9,X-means: Extending K-means with Efficient Estimation of the Number of Clusters,https://www.semanticscholar.org/paper/d7d385f45c096082812deb1623e5af2c2915b4a9,,http://cs.uef.fi/~zhao/Courses/Clustering2012/Xmeans.pdf,,"HTTPConnectionPool(host='cs.uef.fi', port=80): Max retries exceeded with url: /~zhao/Courses/Clustering2012/Xmeans.pdf (Caused by ConnectTimeoutError(<urllib3.connection.HTTPConnection object at 0x0000018CB17B6DD0>, 'Connection to cs.uef.fi timed out. (connect timeout=30)'))"
f0765fff-d829-41d7-b120-15e7d26570ea,f9e9147c42705b4ecb182b94276415a619262540,Real-time on-line unconstrained handwriting recognition using statistical methods,https://www.semanticscholar.org/paper/f9e9147c42705b4ecb182b94276415a619262540,https://doi.org/10.1109/ICASSP.1995.480098,http://www.researchgate.net/profile/Homayoon_Beigi/publication/3618780_Real-time_on-line_unconstrained_handwriting_recognition_usingstatistical_methods/links/0c96051c9a52ccf1db000000.pdf,,"HTTPSConnectionPool(host='www.researchgate.net', port=443): Max retries exceeded with url: /profile/Homayoon_Beigi/publication/3618780_Real-time_on-line_unconstrained_handwriting_recognition_usingstatistical_methods/links/0c96051c9a52ccf1db000000.pdf (Caused by ResponseError('too many 403 error responses'))"
f7a803cc-e681-46c1-a015-6ae10e1639b6,200ab3b7ccfe2e6c3a02a4b53b3ed67fc1d2aa3d,DistAl: An inter-pattern distance-based constructive learning algorithm,https://www.semanticscholar.org/paper/200ab3b7ccfe2e6c3a02a4b53b3ed67fc1d2aa3d,https://doi.org/10.1016/S1088-467X%2899%2900005-0,http://web.cs.iastate.edu/~honavar/Papers/distal-new.pdf,,"HTTPSConnectionPool(host='web.cs.iastate.edu', port=443): Max retries exceeded with url: /~honavar (Caused by ResponseError('too many 503 error responses'))"
eda05832-b7e4-472b-9e4b-2312d3fcdf01,fa37d073c2ded31683def89c5038c23c0e107422,Generative learning structures and processes for generalized connectionist networks,https://www.semanticscholar.org/paper/fa37d073c2ded31683def89c5038c23c0e107422,https://doi.org/10.1016/0020-0255%2893%2990049-R,http://web.cs.iastate.edu/~honavar/Papers/generate93.pdf,,"HTTPSConnectionPool(host='web.cs.iastate.edu', port=443): Max retries exceeded with url: /~honavar (Caused by ResponseError('too many 503 error responses'))"
