uuid,paper_id,title,paper_link,doi,download_link
2ca79f91-9310-47bc-b2c7-12b7d7208d32,c5f99e1cf5d42b90182a4ddc3040949018ec3e41,"Frequency locking, frequency modulation, and bifurcations in dynamic movement systems",https://www.semanticscholar.org/paper/c5f99e1cf5d42b90182a4ddc3040949018ec3e41,,No links found
64e99da2-99cd-489b-8dfc-a2d43100e428,db1f369d893d7c62e057494ac4c80db4fc563451,CIFI: An Intelligent Agent for Citation Finding on The World-wide Web,https://www.semanticscholar.org/paper/db1f369d893d7c62e057494ac4c80db4fc563451,https://doi.org/10.1007/3-540-61532-6_49,No links found
39d59494-73f2-4573-9ae1-4b244fd7a1d1,fbde48690731f520073668adfc33e63d997146c2,First-order vs. Second-order Single Layer Recurrent Neural Networks,https://www.semanticscholar.org/paper/fbde48690731f520073668adfc33e63d997146c2,,No links found
f5c30026-dd5d-4818-a6a3-1da9d75e30e2,4083ad1066cfa2ff0d65866ef4b011399d6873d1,Relevance feedback in information retrieval,https://www.semanticscholar.org/paper/4083ad1066cfa2ff0d65866ef4b011399d6873d1,,No links found
c0b0a218-fd76-459b-9256-69d939d0c48a,4fcb6503b8430f8bfe0dd6351fcc34136af0ea2d,The Librarian's Assistant: Automatically Organizing On-line Books into Dynamic Bookshelves,https://www.semanticscholar.org/paper/4fcb6503b8430f8bfe0dd6351fcc34136af0ea2d,https://doi.org/10.5555/2856823.2856845,No links found
e6f87603-eb26-47ad-a9a6-5e5cf55d400b,aa52bc97b1551369ea6fa68d9a027589f5a84841,Adapting a full-text information retrieval system to the computer troubleshooting domain,https://www.semanticscholar.org/paper/aa52bc97b1551369ea6fa68d9a027589f5a84841,https://doi.org/10.1007/978-1-4471-2099-5_36,No links found
d56ed4d2-19f7-4390-baa2-f9faa263bef0,f982ac20179602817712c3f4c6ea05575e523d9c,A Summary of the CLARIT project,https://www.semanticscholar.org/paper/f982ac20179602817712c3f4c6ea05575e523d9c,,No links found
7e5b1541-8670-4048-a80f-c066bea02cc3,038c7e519a63e4c7b4e3c6b17c7fcae7f019d822,Model Management Systems: Proposed Model Representations and Future Designs,https://www.semanticscholar.org/paper/038c7e519a63e4c7b4e3c6b17c7fcae7f019d822,,No links found
46556dfb-af60-4cc3-a61c-6ea0b5fb4ffc,06cda3014e3fc528ea588198103f4ed8d4095d17,Model Management in Decision Support Systems,https://www.semanticscholar.org/paper/06cda3014e3fc528ea588198103f4ed8d4095d17,https://doi.org/10.1007/978-94-009-7029-8_7,No links found
929ab934-5a73-4ea1-b656-ee4b2f96d0b1,1fedfd08d321bbe3640be8a9871d1e72929f9996,Why are online catalogs still hard to use,https://www.semanticscholar.org/paper/1fedfd08d321bbe3640be8a9871d1e72929f9996,https://doi.org/10.1002/%28SICI%291097-4571%28199607%2947%3A7%3C493%3A%3AAID-ASI3%3E3.3.CO%3B2-Y,No links found
2b4b25bd-2761-48f6-b62f-aa8c7b5b7768,5e40ea249dfad6d8d133b7917ca031c0b32410a5,An Analysis of Bayesian Classifiers,https://www.semanticscholar.org/paper/5e40ea249dfad6d8d133b7917ca031c0b32410a5,,No links found
66b09c8d-1c8c-47a0-a937-3fc115afc048,7ca2f194856e80387ab6a66014d1b2025afe12db,The new science of management decision,https://www.semanticscholar.org/paper/7ca2f194856e80387ab6a66014d1b2025afe12db,https://doi.org/10.5465/amr.1978.4297098,No links found
85a5880e-6a89-4b76-849f-eb050e8e5f93,93b5056d7cd0517aa961373f16d6ab1f78c797ab,Information Retrieval: Still Butting Heads with Natural Language Processing?,https://www.semanticscholar.org/paper/93b5056d7cd0517aa961373f16d6ab1f78c797ab,https://doi.org/10.1007/3-540-63438-X_7,No links found
2afdc051-a19e-4c97-9d27-a220c892bb62,97ac3841601e82e900a32f3a1796faa2899b96b5,Managing gigabytes,https://www.semanticscholar.org/paper/97ac3841601e82e900a32f3a1796faa2899b96b5,,No links found
638a653c-8f23-450c-9c23-8bbe1614f5bf,985e5a5880ffbfc9f295e0cd16c7abb70ba26cdb,Browsing: a multidimensional framework,https://www.semanticscholar.org/paper/985e5a5880ffbfc9f295e0cd16c7abb70ba26cdb,,No links found
e635f45d-6bab-481e-a2bd-2babbed34afd,c30d70220ad58159bc44ab63a28dc08b4d081f27,Concept Extraction in the Interspace Prototype,https://www.semanticscholar.org/paper/c30d70220ad58159bc44ab63a28dc08b4d081f27,,No links found
ff062fb2-df3c-4ed2-b337-98c4d6f6aac2,ca1783cbf29ece03a4a4f698e5c5a36c468b4053,Proceedings of the 10th annual international ACM SIGIR conference on Research and development in information retrieval,https://www.semanticscholar.org/paper/ca1783cbf29ece03a4a4f698e5c5a36c468b4053,,No links found
71c565dd-9781-4a67-86a2-ddaed09a8020,cb29dc0e95ea96169c79097eb72804b018b999a5,Link as you type: using key phrases for automated dynamic link generation,https://www.semanticscholar.org/paper/cb29dc0e95ea96169c79097eb72804b018b999a5,,No links found
a441787d-e7bd-4a77-a09d-b744cdefaeeb,d7523004d8c4be3a56d0b2d8ef98cf95087ff15b,Dynamic Metasystems for Information Systems Development,https://www.semanticscholar.org/paper/d7523004d8c4be3a56d0b2d8ef98cf95087ff15b,,No links found
08a5ea4a-0bb2-49e2-950b-8b6fd5927dca,d7e54385af2c08480b6edac556d33ce24b33f466,Challenging strategic planning assumptions,https://www.semanticscholar.org/paper/d7e54385af2c08480b6edac556d33ce24b33f466,,No links found
9c77a5bd-41fc-45b2-8f50-00d1840b21ba,f44e0b5372a4fb1d8e1b15ca9e9cab7b4d65dd94,Automatic text processing,https://www.semanticscholar.org/paper/f44e0b5372a4fb1d8e1b15ca9e9cab7b4d65dd94,,No links found
48a003e8-b9a3-4180-bb3d-395ca5a8d3ec,1acb18b8db0fad968e7477c866332a28dc37ff92,Multimedia information retrieval,https://www.semanticscholar.org/paper/1acb18b8db0fad968e7477c866332a28dc37ff92,https://doi.org/10.1007/springerreference_65342,No links found
b64006a9-28fc-4c2c-9984-7cacfb3775a6,49bfb8dc31cd9bded374d3bc990dc0513fb47760,Automatic text structuring experiments,https://www.semanticscholar.org/paper/49bfb8dc31cd9bded374d3bc990dc0513fb47760,,No links found
20bfa478-6cd7-4675-80ec-8ce08b7b3339,4af7f74558e0389cd6d0330473877ed9256c4cf5,Building Hypertexts under the Influence of Topology Metrics,https://www.semanticscholar.org/paper/4af7f74558e0389cd6d0330473877ed9256c4cf5,https://doi.org/10.1007/978-1-4471-3082-6_12,No links found
a605a822-823a-44d0-8da6-f9cde0346ff4,5266f78839e4b0a96e902b12155d07aaa58813d8,On the Automatic Generation of Content Links in Hypertext,https://www.semanticscholar.org/paper/5266f78839e4b0a96e902b12155d07aaa58813d8,,No links found
e7bdd5c4-2aa3-42b8-93b7-38e988314189,7f32a86dd127e4b02ee26c6e21b27777beb58cc0,TACHIR: A Tool for Automatic Construction of Hypertexts for Information Retrieval,https://www.semanticscholar.org/paper/7f32a86dd127e4b02ee26c6e21b27777beb58cc0,https://doi.org/10.5555/2856823.2856854,No links found
671bb30b-9318-4d39-a57d-97a2bfdb91d6,99f5d79da460a87b2fe802f3d70a83d58e4d0daf,I3R: A new approach to the design of document retrieval systems,https://www.semanticscholar.org/paper/99f5d79da460a87b2fe802f3d70a83d58e4d0daf,https://doi.org/10.1002/%28SICI%291097-4571%28198711%2938%3A6%253C389%3A%3AAID-ASI1%253E3.0.CO%3B2-4,No links found
d9ae4468-2c76-4905-886a-698b35191e45,9e361be570d627f1b8d3da22f4048f5021548b61,Converting a textbook to hypertext,https://www.semanticscholar.org/paper/9e361be570d627f1b8d3da22f4048f5021548b61,,No links found
6e30ec98-a1d6-47ef-ac16-b8a4497ea9d9,a598d7bb5541dce0d3b36e6231ce1351a5742056,User Navigation in the IRS Conceptual Structure through a Semantic Association Function,https://www.semanticscholar.org/paper/a598d7bb5541dce0d3b36e6231ce1351a5742056,,No links found
e35cec03-d457-4732-9702-7405ea4be16e,b4d5e9f64d4a3e8177076c9c7449f0e4a722a8cc,Incremental relevance feedback,https://www.semanticscholar.org/paper/b4d5e9f64d4a3e8177076c9c7449f0e4a722a8cc,,No links found
d1aacd8d-94bd-4186-8a65-daf7a9180dd1,c296f951b6bb5bcbc55f81721ecaf215370c8afc,Experiments on the automatic construction of hypertexts from texts,https://www.semanticscholar.org/paper/c296f951b6bb5bcbc55f81721ecaf215370c8afc,,No links found
e3a8446f-c2b3-4a7c-ac9e-8ab283c4b460,cd6afaeab82900bdd77c8df827c1ca26474139b0,The Representation and Comparison of Hypertext Structures using Graphs in Information Retrieval and,https://www.semanticscholar.org/paper/cd6afaeab82900bdd77c8df827c1ca26474139b0,,No links found
564dd8fb-7204-4c23-afbf-6b282c642b09,d2af5c9589a73608f36b3dd90b9abeae0120cda6,Automatic Hypertext Construction,https://www.semanticscholar.org/paper/d2af5c9589a73608f36b3dd90b9abeae0120cda6,,No links found
6d86d045-414a-4ba3-811b-1a7b276a36b3,d537c2a04f0c22595edb6766f73d3d6d4bc7b484,A two-level hypertext retrieval model for legal data,https://www.semanticscholar.org/paper/d537c2a04f0c22595edb6766f73d3d6d4bc7b484,,No links found
8ca454c6-277b-42fb-8df1-6664c79c636a,ddf57f8809129e9c3e4c6ed0d5109e44161f568f,A methodology for the automatic construction of a hypertext for information retrieval,https://www.semanticscholar.org/paper/ddf57f8809129e9c3e4c6ed0d5109e44161f568f,,No links found
f7b0c240-9606-4627-896d-cb4679564dd8,dfe32fd95540fdb91ef61613d3937bb89dd7897b,"Hypertext, full text, and automatic linking",https://www.semanticscholar.org/paper/dfe32fd95540fdb91ef61613d3937bb89dd7897b,,No links found
e38a1693-5fb6-4be0-bfb7-b441bc1f2808,e7bf13c5b453e2baa5d59938f2a39a2aa4ba4719,Information Retrieval and Hypertext,https://www.semanticscholar.org/paper/e7bf13c5b453e2baa5d59938f2a39a2aa4ba4719,,No links found
0c58001e-3e25-4118-ab7e-1c31a865ec0b,ea0a2d6ceac3868046b3dfe1aac4b8e0076747dc,Automatic Text Decomposition and Structuring,https://www.semanticscholar.org/paper/ea0a2d6ceac3868046b3dfe1aac4b8e0076747dc,,No links found
dd995069-cdde-41e7-95a3-860257923c86,f492477752b88be89ab897907b18e68c881e6498,"Automatic Analysis, Theme Generation, and Summarization of Machine-Readable Texts",https://www.semanticscholar.org/paper/f492477752b88be89ab897907b18e68c881e6498,,No links found
77cb3d17-621e-48c5-9860-6b2eddd9af03,f4b2300a3d4054d3fe67767833f54a1f9bd8feff,LaTeX User''''s Guide and Document Reference Manual,https://www.semanticscholar.org/paper/f4b2300a3d4054d3fe67767833f54a1f9bd8feff,,No links found
690c8106-0d94-4598-85c6-a06cbb152d62,f83340935ad31f6ef846299c9380035acc69c9c0,Automatically transforming regularly structured linear documents into hypertext,https://www.semanticscholar.org/paper/f83340935ad31f6ef846299c9380035acc69c9c0,,No links found
71bbcf0a-4594-42ca-981d-3f252bd5bd92,00dc2bd799a58aa1631d7e5a27c1f4c5ff315030,Approximate Matching for Evaluating Keyphrase Extraction,https://www.semanticscholar.org/paper/00dc2bd799a58aa1631d7e5a27c1f4c5ff315030,,No links found
09a92085-e4e7-471c-b902-9a1ade866324,1cf65a8c9e9ac8bd1db487004185ad0e15b9b9dd,Keyphrase Extraction in Scientific Publications,https://www.semanticscholar.org/paper/1cf65a8c9e9ac8bd1db487004185ad0e15b9b9dd,,No links found
7b3d7b7f-4c97-441b-8d37-b79deaaeff89,1ebb9b20a7477a0498449968f04fffee7d8165f7,Thesaurus based automatic keyphrase indexing,https://www.semanticscholar.org/paper/1ebb9b20a7477a0498449968f04fffee7d8165f7,,No links found
fb6a1ecd-69a8-435b-a5cb-f9cea141950f,228bad0fb34135758e80539a5d8463b2820dcb98,Finding topic words for hierarchical summarization,https://www.semanticscholar.org/paper/228bad0fb34135758e80539a5d8463b2820dcb98,,No links found
9552aa03-ca8a-41c3-ac48-3bc58c319881,26324601f7c25430adbbeec931b28cf11b2dbe81,Using Noun Phrase Heads to Extract Document Keyphrases,https://www.semanticscholar.org/paper/26324601f7c25430adbbeec931b28cf11b2dbe81,,No links found
2c5c41f8-b12c-47dc-8673-3a35e060182d,2d7f212d9251afc479d9a67570d5e0a5b4337d04,Domain-specific keyphrase extraction,https://www.semanticscholar.org/paper/2d7f212d9251afc479d9a67570d5e0a5b4337d04,,No links found
e4658a3f-e3c6-4294-a552-e1ec081fc1e5,3937668b4c34d3801ba929b84be115d99bcf749c,Automatic Glossary Extraction: Beyond Terminology Identification,https://www.semanticscholar.org/paper/3937668b4c34d3801ba929b84be115d99bcf749c,,No links found
1c0dc270-4632-48ec-b498-181310289519,48b5041a24cbf3048c97e85c4fd7c0214da942b5,CollabRank: Towards a Collaborative Approach to Single-Document Keyphrase Extraction,https://www.semanticscholar.org/paper/48b5041a24cbf3048c97e85c4fd7c0214da942b5,,No links found
32f6e035-7f15-4bba-b285-97bd38fe5077,6f915f50f273c8b561978761f9ea2179e8d25296,Learning to Extract Keyphrases from Text,https://www.semanticscholar.org/paper/6f915f50f273c8b561978761f9ea2179e8d25296,,No links found
466ccea2-8c1f-4439-ab94-b18f7ca4fa7f,771ca13f78a6cfda9ed99004a386e9e7e187bd34,Improved Automatic Keyword Extraction Given More Linguistic Knowledge,https://www.semanticscholar.org/paper/771ca13f78a6cfda9ed99004a386e9e7e187bd34,,No links found
f22cc1ae-8f53-485f-8575-7e0834cbc254,7b95d389bc6affe6a127d53b04bcfd68138f1a1a,TextRank: Bringing Order into Text,https://www.semanticscholar.org/paper/7b95d389bc6affe6a127d53b04bcfd68138f1a1a,,No links found
f4a58b52-233f-40a6-bb92-a5e654375bae,83b2f3f334036ff792cdf1f8d1dff183813fae1e,An Ontology-Based Approach for Key Phrase Extraction,https://www.semanticscholar.org/paper/83b2f3f334036ff792cdf1f8d1dff183813fae1e,,No links found
ca7ec673-a22b-418a-b0af-b3a8424475f1,8d1008a699d8f4084cffb32f2bd540af458edf05,Coherent Keyphrase Extraction via Web Mining,https://www.semanticscholar.org/paper/8d1008a699d8f4084cffb32f2bd540af458edf05,,No links found
330371a7-e89c-443f-9657-b9255ee57703,ee800bab67e177e4676578f621db59a0faa736cd,Human-competitive automatic topic indexing,https://www.semanticscholar.org/paper/ee800bab67e177e4676578f621db59a0faa736cd,,No links found
ce0eef1d-fe10-44b7-9c84-c2ddd76ec003,00ee2e3f19be3be3a0303ac08ed5fc60e0d38c69,Building Concept Representations from Reusable Components,https://www.semanticscholar.org/paper/00ee2e3f19be3be3a0303ac08ed5fc60e0d38c69,,No links found
b64de4eb-acd2-4f73-84b6-2bf2baed7589,f9a40fab814590abf146128c70f059131d0654c9,Learning Concept Hierarchies from Text with a Guided Agglomerative Clustering Algorithm,https://www.semanticscholar.org/paper/f9a40fab814590abf146128c70f059131d0654c9,,No links found
8176e065-b06c-4e0f-9540-f29a4cf946a5,37e26535be2a5add1be5f2b41351d5f6eb0e7812,Evaluation of a Dutch stemming algorithm,https://www.semanticscholar.org/paper/37e26535be2a5add1be5f2b41351d5f6eb0e7812,,No links found
f5f71a16-8b60-4faf-bcbc-521c66b3a53c,a9bb51c027a51df07317b3ae8d2a22c707bbd6f8,Word sense disambiguation for large text databases,https://www.semanticscholar.org/paper/a9bb51c027a51df07317b3ae8d2a22c707bbd6f8,,No links found
1d2fc683-06c9-4782-a216-81ee219b4b41,176876ea4114f376d2e2815dc413aed5292ea1bb,An Introduction To Modern English Word Formation,https://www.semanticscholar.org/paper/176876ea4114f376d2e2815dc413aed5292ea1bb,https://doi.org/10.4324/9781315504254,No links found
45ec737f-10a5-4caf-86ba-b2cfd43658e6,22a9bd69af171691a8e7f72ea18f7ab80729febe,"Non-morphematic word-formation processes: a multi-level approach to acronyms, blends, clippings and onomatopoeia",https://www.semanticscholar.org/paper/22a9bd69af171691a8e7f72ea18f7ab80729febe,,No links found
6ced6d86-166d-411f-99c6-2417e12ac3a7,263bf0d65ca7e703ca2b843610838cf1db723bef,A dictionary of stylistics,https://www.semanticscholar.org/paper/263bf0d65ca7e703ca2b843610838cf1db723bef,https://doi.org/10.5860/choice.27-1907,No links found
6e126e1f-1547-4d48-8cfe-5d22eaa96149,35ae4466adb49964f9bee0d53c840b95825e3516,"The life of language : the fascinating ways words are born, live & die",https://www.semanticscholar.org/paper/35ae4466adb49964f9bee0d53c840b95825e3516,https://doi.org/10.5860/choice.44-3134,No links found
c5c826a0-4f18-4f75-8300-dd4b04b31dd6,4e870aa1eeb1ade890de0d144addf8485a10c7bc,"Das Kurzwort im Deutschen: Eine Untersuchung zu Definition, Typologie und Entwicklung",https://www.semanticscholar.org/paper/4e870aa1eeb1ade890de0d144addf8485a10c7bc,https://doi.org/10.1515/9783110954692,No links found
31b29d20-5ba4-4955-8327-3a910573c722,7d93cdf3aeb9e48075e775abc1b06d3e200651a9,The Oxford companion to the English language,https://www.semanticscholar.org/paper/7d93cdf3aeb9e48075e775abc1b06d3e200651a9,https://doi.org/10.1093/ACREF%2F9780199661282.001.0001,No links found
5f67ceb2-c49e-459f-81c9-c20fbf83026c,8457a2a685fbf61229e9a50d49b431f40ba1c44a,"Proceedings of the Twelfth International Congress of Linguists : Vienna, August 28-September 2, 1977",https://www.semanticscholar.org/paper/8457a2a685fbf61229e9a50d49b431f40ba1c44a,,No links found
3024f08d-3a8c-4560-894c-8f8f696f959f,887f890318f89029edef4d872df4607249a20e99,The Life of Language,https://www.semanticscholar.org/paper/887f890318f89029edef4d872df4607249a20e99,,No links found
09ac2937-13b4-4c8f-a323-996c1921494d,8b25251e8004632e26444979a69995f1071346b0,Clipping and acronymy,https://www.semanticscholar.org/paper/8b25251e8004632e26444979a69995f1071346b0,https://doi.org/10.1515/9783110111286.1.12.956,No links found
f7088678-0712-4573-9695-96c884c5fd02,9aa37a491016baa7b2f9a08a1e0a30e72be827aa,Words and Rules: The Ingredients of Language,https://www.semanticscholar.org/paper/9aa37a491016baa7b2f9a08a1e0a30e72be827aa,,No links found
97151509-cc87-4d10-8c11-27800ac4d194,a7564fdbccf97e9b2b4ba3fc99f1d4c19926446f,Historical change and English word-formation,https://www.semanticscholar.org/paper/a7564fdbccf97e9b2b4ba3fc99f1d4c19926446f,,No links found
60c334ab-3377-403e-b206-7941ded017d4,cb55c820c92096d54b22494dc0c08a09dd77d860,Deutsch-deutsche Kommunikationserfahrungen im arbeitsweltlichen Alltag,https://www.semanticscholar.org/paper/cb55c820c92096d54b22494dc0c08a09dd77d860,,No links found
5b8f59ec-11bb-4689-b901-53167bdaed6d,d28152f77d5861abadedb415254c64139d094194,"English lexicology : lexical structure, word semantics & word-formation",https://www.semanticscholar.org/paper/d28152f77d5861abadedb415254c64139d094194,,No links found
a5946a70-d77d-40bd-a093-966875f058fd,d2dd1069a44b09a81c730814692a6be9380314a9,The categories and types of present-day English word-formation : a synchronic-diachronic approach,https://www.semanticscholar.org/paper/d2dd1069a44b09a81c730814692a6be9380314a9,,No links found
ca22acdb-325d-4c05-8b3c-00f865ba1c3b,e645094cfcd8b8b086c027763136ea246d2ec25b,English Word-Formation,https://www.semanticscholar.org/paper/e645094cfcd8b8b086c027763136ea246d2ec25b,https://doi.org/10.1017/CBO9781139165846,No links found
b5282af2-1b51-415b-9542-a1c29c22e3f0,eae1114768123abe5d8428de3e1d24e87e52da9c,Stress in reduplicative compounds : Mish-mash or hocus-pocus?,https://www.semanticscholar.org/paper/eae1114768123abe5d8428de3e1d24e87e52da9c,,No links found
8afe0b57-7c60-4812-8c48-3947a1ef1370,fb980fa71188e29ebab92190d4c7f30899f53b71,The Cambridge Encyclopedia of the English Language,https://www.semanticscholar.org/paper/fb980fa71188e29ebab92190d4c7f30899f53b71,https://doi.org/10.1017/9781108528931,No links found
4921ec42-9a9a-4871-ae02-b2070c4684e1,06ca3092f1136bc3f49ff1d54999d676a503131a,Oxford English Dictionary (2nd ed.),https://www.semanticscholar.org/paper/06ca3092f1136bc3f49ff1d54999d676a503131a,,No links found
067e1c20-8631-4379-ab0e-29ff84f09360,d76cab0747c1a46d42d4dd667453ca09ad8e8b32,Urological surgery,https://www.semanticscholar.org/paper/d76cab0747c1a46d42d4dd667453ca09ad8e8b32,https://doi.org/10.1136/BMJ.317.7167.2,No links found
1d470d61-11e7-4b29-aca3-421e7ed06b7b,fccc47d68ea2b5edcba23293b10f7aa4fd82302d,"W. Strunk, Jr. and E.B. White: The Elements of Style, MacMillan Co,, New York, 1959, 71, 1321cm, $2.95. Paperback 1117cm, $0.95",https://www.semanticscholar.org/paper/fccc47d68ea2b5edcba23293b10f7aa4fd82302d,,No links found
44952754-682d-4d34-844a-520c5aacc090,380e15e151130a707046b48550c2560972a77954,Automatic Keyphrase Generation,https://www.semanticscholar.org/paper/380e15e151130a707046b48550c2560972a77954,,No links found
6e340006-9e12-41e3-bade-6fe12a4a951d,47cb5144741d4181b8d0ff3a8642bced08cdaca9,Proceedings of the 22nd ACM/IEEE Joint Conference on Digital Libraries,https://www.semanticscholar.org/paper/47cb5144741d4181b8d0ff3a8642bced08cdaca9,https://doi.org/10.1145/3529372,No links found
cf0c498e-759b-42ee-aeb4-eb5cc2271aa2,6b296e9c79ea0dba405a77361c7c88fb5bae982a,Computing PageRank using Power Extrapolation,https://www.semanticscholar.org/paper/6b296e9c79ea0dba405a77361c7c88fb5bae982a,,No links found
8624f2c7-f7d6-4352-8090-3cc2b595f957,806c2c4327a31fded64a5d673ab82b133194c234,Introduction to information retrieval,https://www.semanticscholar.org/paper/806c2c4327a31fded64a5d673ab82b133194c234,https://doi.org/10.1017/CBO9780511809071,No links found
b3675998-e5bc-4fd7-84db-159bfa83acbe,945660b9f1e0fbec5c94988e5822f8d6dd3e7510,Automatic keyphrase extraction and ontology mining for content-based tag recommendation,https://www.semanticscholar.org/paper/945660b9f1e0fbec5c94988e5822f8d6dd3e7510,https://doi.org/10.1002/INT.V25%3A12,No links found
8d403e7b-6356-4e7f-bfa6-e895c09a05f9,22e64291f18cbf3309fe1624a16a18722e1da381,Assessing agreement on classification tasks,https://www.semanticscholar.org/paper/22e64291f18cbf3309fe1624a16a18722e1da381,,No links found
33096e5e-5eeb-4ed8-8843-5bd30a3bc9d7,4dc90c9a7a21fcc0dcfac671ab25261ca2e75389,Test-Driving TANKA: Evaluating a Semi-automatic System of Text Analysis for Knowledge Acquisition,https://www.semanticscholar.org/paper/4dc90c9a7a21fcc0dcfac671ab25261ca2e75389,https://doi.org/10.1007/3-540-64575-6_40,No links found
0f072604-1f63-4b70-92fa-40e1007a4c03,c73409031056897e67884c6d5852a5c146235c99,Text processing without a priori domain knowledge: semi-automatic linguistic analysis for incremental knowledge acquisition,https://www.semanticscholar.org/paper/c73409031056897e67884c6d5852a5c146235c99,https://doi.org/10.20381/RUOR-14908,No links found
534770b0-140e-4873-8eb2-333ac52f423a,d9ff3082be8ba7d91e9d74ad90cf7492ab58021b,"Proceedings of the Fourth ACM conference on Digital Libraries, August 11-14, 1999, Berkeley, CA, USA",https://www.semanticscholar.org/paper/d9ff3082be8ba7d91e9d74ad90cf7492ab58021b,,No links found
3dbd5ed7-fc58-42da-b3a1-5ea6b2be3682,de9feb8515cd6862df9a6b6f593fe62c2a6e1631,The Design of a Conngurable Text Summarization System,https://www.semanticscholar.org/paper/de9feb8515cd6862df9a6b6f593fe62c2a6e1631,,No links found
85562979-84bf-4fbb-88c6-46bc942400a7,3ef0325da979bbf36ce8ea29de71d9a6cd495ea7,Estimation of Risk Reduction,https://www.semanticscholar.org/paper/3ef0325da979bbf36ce8ea29de71d9a6cd495ea7,https://doi.org/10.1161/CIRC.99.14.1922%2FB,No links found
730cec20-8102-47a3-8f85-eb45236a93fa,4840ca86c2ed8577388562c199101c2e4136503d,[Chest pain syndrome in normal or non-diagnostic conventional ECG at the emergency service. Assessment with myocardial perfusion (SPECT) and ventricular function (Gated-SPECT)].,https://www.semanticscholar.org/paper/4840ca86c2ed8577388562c199101c2e4136503d,,No links found
1a2e7489-e997-4a86-8d9e-4f24d99cb704,566e5bb87d5ab5e4197daa43234e9a38922ab811,Proper use of an acronym in a publication.,https://www.semanticscholar.org/paper/566e5bb87d5ab5e4197daa43234e9a38922ab811,,No links found
faee952b-6f9a-4196-af98-f83a367dad86,8cf82cf76e823954acbce5f194b59773b3561c5f,Unexplained acronyms.,https://www.semanticscholar.org/paper/8cf82cf76e823954acbce5f194b59773b3561c5f,https://doi.org/10.1161/circ.99.14.1922%2Fc,No links found
e20c2eda-d608-4425-b64a-30f3b5fbd90b,ac695d110ea3d51d5e403ae37e74e19bba0f81cb,Proper use of an acronym in a publication.,https://www.semanticscholar.org/paper/ac695d110ea3d51d5e403ae37e74e19bba0f81cb,,No links found
450c855c-c1d5-48f4-a51d-990ee8a396a0,b60acfbb6661f11cd07f4d73362edfa43782b07e,Please write out the acronyms every time.,https://www.semanticscholar.org/paper/b60acfbb6661f11cd07f4d73362edfa43782b07e,,No links found
d5b8467f-2d3a-4edd-8417-c88951a0e70c,e8c3f2cd88787508937f650bb0860fb04129d9a8,Acronymesis: the exploding misuse of acronyms.,https://www.semanticscholar.org/paper/e8c3f2cd88787508937f650bb0860fb04129d9a8,,No links found
7b6abfa3-abde-469f-af41-0bd531f5a1d3,59284349b82bdc1184cb11343d7bad6e5934ad08,The Ranking of Query Refinements in Interactive Web-based Retrieval,https://www.semanticscholar.org/paper/59284349b82bdc1184cb11343d7bad6e5934ad08,,No links found
9a177370-d36e-4356-9b7c-5e23bf21a391,927881a5602f430ffd145d44b8c35cf7a07b464d,[C],https://www.semanticscholar.org/paper/927881a5602f430ffd145d44b8c35cf7a07b464d,https://doi.org/10.1093/oseo%2Finstance.00237919,No links found
8db427fb-80f5-4115-853e-b057aa440e24,c18ecb6fb4a45d8c431340e32f14fb8ae4edce65,Query Reformulation on the Internet: Empirical Data and the Hyperindex Search Engine,https://www.semanticscholar.org/paper/c18ecb6fb4a45d8c431340e32f14fb8ae4edce65,https://doi.org/10.5555/2856695.2856738,No links found
b4e5c2cb-8f09-4db7-bd33-605617a88bac,c90489630045094b7444dfa1eba24a0d70692f5f,Automatic construction of faceted terminological feedback for context-based information retrieval,https://www.semanticscholar.org/paper/c90489630045094b7444dfa1eba24a0d70692f5f,,No links found
e1363e6f-e583-48f0-8d0b-a4482d378f6d,6d4d302c7aeb48ba2b89905ae22ee99a2910bebc,"NAACL HLT 2007 - Human Language Technologies 2007: The Conference of the North American Chapter of the Association for Computational Linguistics, Proceedings of the Main Conference",https://www.semanticscholar.org/paper/6d4d302c7aeb48ba2b89905ae22ee99a2910bebc,,No links found
23f6d63e-491a-4162-a63a-4a90a4446af4,90e067c6c001a4ec549d5e141736295a77004039,Extracting Relations from Large Plain-Text Collections,https://www.semanticscholar.org/paper/90e067c6c001a4ec549d5e141736295a77004039,https://doi.org/10.7916/D8NG4ZHK,No links found
60c8983b-82e9-4cae-a247-818800ec7944,a560fad06fd18076c8c6339f487b27d06e660bd8,Is man the measure,https://www.semanticscholar.org/paper/a560fad06fd18076c8c6339f487b27d06e660bd8,https://doi.org/10.5840/PHILINQUIRY1997191%2F213,No links found
779c399d-65c6-4469-91db-2f4c1af0daac,ae405d63528a1be39e9ef71a3b420bed4a3d4f1f,"Proceedings of the International Joint Conference on Artificial Intelligence : IJCAI-69, 7-9 May 1969, Washington, D.C.",https://www.semanticscholar.org/paper/ae405d63528a1be39e9ef71a3b420bed4a3d4f1f,,No links found
20baead3-cba6-4f9b-965e-07ebf910e6d9,c10c979c5148ed1a3940974efa1b3a355b80e163,Kernel methods for relation extraction,https://www.semanticscholar.org/paper/c10c979c5148ed1a3940974efa1b3a355b80e163,https://doi.org/10.1162/153244303322533205,No links found
