uuid,paper_id,title,paper_link,doi,download_link
f1d70e18-53b6-4c45-a407-08b117fd4a3f,62b57aadc59516d67971a858ac0d952bd0e5d242,Bacterial contamination of the water supply in newly installed dental units.,https://www.semanticscholar.org/paper/62b57aadc59516d67971a858ac0d952bd0e5d242,,No links found
32c5f02d-c4d6-41d9-a626-fc2ffee68d11,6adea2ccdba6662e7256216ac1833e7877f0eabf,Pseudomonas aeruginosa wound infection associated with a nursing home's whirlpool bath.,https://www.semanticscholar.org/paper/6adea2ccdba6662e7256216ac1833e7877f0eabf,,No links found
8f138435-f3eb-4844-9fab-2dbf8374a6e9,6d1061e63d21487c1581d9df981ba29817777090,The effect of steam sterilization on the physical properties and perceived cutting characteristics of extracted teeth.,https://www.semanticscholar.org/paper/6d1061e63d21487c1581d9df981ba29817777090,https://doi.org/10.1002/J.0022-0337.1998.62.3.TB03194.X,No links found
c8d37e6c-cd58-41a0-ae10-f062a2c38c9d,75c4fa35dc0faac1efe3e6578f10c9a64106fe88,Perforation of dental gloves during prosthodontic treatments as assessed by the conductivity and water inflation tests.,https://www.semanticscholar.org/paper/75c4fa35dc0faac1efe3e6578f10c9a64106fe88,,No links found
792f5027-15b3-4371-86ac-4b5ea78baa31,79af082c6aea9da08c109f65cc93b73178f25a51,Assessing the public health threat associated with waterborne cryptosporidiosis : report of a workshop,https://www.semanticscholar.org/paper/79af082c6aea9da08c109f65cc93b73178f25a51,,No links found
8c4ef763-2711-4201-8442-d4297ce33c8a,89ce9b06b0e5cb047108a512f6ae2587983d732c,Hepatitis B transmission from dental personnel to patients: unfinished business.,https://www.semanticscholar.org/paper/89ce9b06b0e5cb047108a512f6ae2587983d732c,https://doi.org/10.7326/0003-4819-96-1-119_1,No links found
98cbc1cd-9eda-4921-8d48-155dce62f801,89d1363a38eeec9779483f579e1d85c1d1bb9ff1,Cross-infection risks associated with current procedures for using high-speed dental handpieces,https://www.semanticscholar.org/paper/89d1363a38eeec9779483f579e1d85c1d1bb9ff1,https://doi.org/10.1128/jcm.30.2.401-406.1992,No links found
3db108bc-d684-4e50-b6e1-3a889c06a336,8c049c8b568bb5bc690238b43f5affaf6e04ab54,Aspergillosis due to carpet contamination.,https://www.semanticscholar.org/paper/8c049c8b568bb5bc690238b43f5affaf6e04ab54,https://doi.org/10.1086/646896,No links found
223a1e7b-e572-468c-a7be-398341797b62,92b4a3765d5ebc1acb8e583a2c1d190434d90548,"CDC guideline for prevention of surgical wound infections, 1985. Supersedes guideline for prevention of surgical wound infections published in 1982. (Originally published in November 1985). Revised.",https://www.semanticscholar.org/paper/92b4a3765d5ebc1acb8e583a2c1d190434d90548,,No links found
60a29fe5-e716-4c8c-9e72-d8cc52e4a20a,9606e067cc6285cbb10e149fb7c3772510fcf7a9,Virus penetration of examination gloves.,https://www.semanticscholar.org/paper/9606e067cc6285cbb10e149fb7c3772510fcf7a9,,No links found
6ba635cc-6ea5-40b4-8533-ae108c3a9b22,9b541a33c965c004f9a725fc01d96d95ec3e3759,Iatrogenic contamination of multidose vials in simulated use. A reassessment of current patient injection technique.,https://www.semanticscholar.org/paper/9b541a33c965c004f9a725fc01d96d95ec3e3759,https://doi.org/10.1001/archderm.126.11.1441,No links found
7a095ad7-0e2a-4374-af56-38c290b7ef27,9c6863a8e3e3e70918a1a2c6637801b5f804cf90,Reliability of biologic indicators in a mail-return sterilization-monitoring service: a review of 3 years.,https://www.semanticscholar.org/paper/9c6863a8e3e3e70918a1a2c6637801b5f804cf90,,No links found
e617845b-8463-4f48-9fb7-156e927552f2,9ea597986fb0308092ca8f01a8412bcebd9db37a,Double gloving and surgical technique.,https://www.semanticscholar.org/paper/9ea597986fb0308092ca8f01a8412bcebd9db37a,,No links found
d99e4452-2fdb-4dc3-bce8-586669d94a73,ac078f1e3d84105c2e9980d352b548f1921d7bcc,Reduction of viable bacteria in dental aerosols by preprocedural rinsing with an antiseptic mouthrinse.,https://www.semanticscholar.org/paper/ac078f1e3d84105c2e9980d352b548f1921d7bcc,,No links found
03589f79-e941-4884-9283-01a80ad39883,af430246ebafa2f522947a7482a7573927e806e2,Permeability of latex and vinyl gloves to water and blood.,https://www.semanticscholar.org/paper/af430246ebafa2f522947a7482a7573927e806e2,,No links found
b272f285-9d53-46a4-be76-02f0420ebf66,b774b3bf977cdff83d47c6b6650897e8ad9075cb,"Performance and Durability of Autoclavable High-Speed Dental Handpieces,",https://www.semanticscholar.org/paper/b774b3bf977cdff83d47c6b6650897e8ad9075cb,,No links found
6ca19984-a785-47db-9b35-8d8de57f75e0,b977921c959314b63ed79af12c62f0f975e19fb8,Hepatitis B among dental patients--Indiana.,https://www.semanticscholar.org/paper/b977921c959314b63ed79af12c62f0f975e19fb8,,No links found
ea9c23f5-37e0-43b1-8ed2-94b7edb80a99,b9f712132cd305dbb31f57457377f8afec8c786e,Microbial penetration of gloves following usage in routine dental procedures.,https://www.semanticscholar.org/paper/b9f712132cd305dbb31f57457377f8afec8c786e,,No links found
4ecb4c72-76d4-4c4f-9ae9-009bd4e9976c,bd8b6c3c7d2927275520ff6c461226da4fa920f7,Latex allergy in hospital employees.,https://www.semanticscholar.org/paper/bd8b6c3c7d2927275520ff6c461226da4fa920f7,,No links found
7853d73a-baf8-4347-805c-20be91ad4a85,bf2d9c821326f5845ffa115e89bd98f9845ed9d1,Multiparametric analysis of waterline contamination in dental units,https://www.semanticscholar.org/paper/bf2d9c821326f5845ffa115e89bd98f9845ed9d1,https://doi.org/10.1128/aem.62.11.3954-3959.1996,No links found
be526245-4f08-4fca-a890-d85eda75d980,c140b16ff676654a8da3a151eb749e08c2abdcba,Guideline for isolation precautions in hospitals. The Hospital Infection Control Practices Advisory Committee.,https://www.semanticscholar.org/paper/c140b16ff676654a8da3a151eb749e08c2abdcba,https://doi.org/10.1086/647190,No links found
5cc048bd-918e-4d77-8102-5ef994f07802,c45cfe07d0363603568c49435b2d3cc9542db777,Handwashing and hand disinfection,https://www.semanticscholar.org/paper/c45cfe07d0363603568c49435b2d3cc9542db777,,No links found
291fbbe6-a075-4cc1-ad2a-508550dd6dec,c536cde139c782af4d9566608f583058ade593c0,Prosthetic fingernails in the OR. A research study.,https://www.semanticscholar.org/paper/c536cde139c782af4d9566608f583058ade593c0,,No links found
d79e7f80-d8fe-44cf-bff0-6a044f3277f0,c5c84518a0d385a6c5d0567be225b6d651dbe10b,Managing regulated waste in dental environments.,https://www.semanticscholar.org/paper/c5c84518a0d385a6c5d0567be225b6d651dbe10b,,No links found
35d384b4-00a1-4231-9871-95bc9f3bf9bf,cb15fc7aec0a45bc3c0291ccd94012607e949a98,Skin and mucous membrane contacts with blood during surgical procedures: risk and prevention.,https://www.semanticscholar.org/paper/cb15fc7aec0a45bc3c0291ccd94012607e949a98,https://doi.org/10.1086/647044,No links found
362dcf70-ad69-400e-906d-5b04c5d0b8a6,ccbdf094c7de29ca71d467e87cbd5407d000554f,Recommendations for preventing transmission of infections among chronic hemodialysis patients,https://www.semanticscholar.org/paper/ccbdf094c7de29ca71d467e87cbd5407d000554f,,No links found
ab312655-eb43-46c3-9c94-39466ef0c6fd,cdb56d94a0d1ae155f35789c82cc6270fc4ca962,Viral hepatitis B: aspects of environmental control.,https://www.semanticscholar.org/paper/cdb56d94a0d1ae155f35789c82cc6270fc4ca962,,No links found
3bbdd085-c80d-4651-8ed4-66021e4ba81d,d3534b56d6d50880963042e0da7c21486094bb51,The use of sterile versus nonsterile gloves during out-patient exodontia.,https://www.semanticscholar.org/paper/d3534b56d6d50880963042e0da7c21486094bb51,,No links found
8ecac7a6-864b-4269-977d-357fcfc6bbde,d87a126cd731157e75f4eaf165327bc259cd7bdf,Disinfection of human teeth for educational purposes.,https://www.semanticscholar.org/paper/d87a126cd731157e75f4eaf165327bc259cd7bdf,https://doi.org/10.1002/J.0022-0337.1991.55.9.TB02567.X,No links found
e35eaeef-2fad-4b67-8371-738f90f58d45,d956b1682f6535a11072a27ce8d3a866d82e5aca,"TBINFECTION CONTROL RECOMMENDATIONS FROMTHE(DC,1994: CONSIDERATIONS FOR DENTISTRY",https://www.semanticscholar.org/paper/d956b1682f6535a11072a27ce8d3a866d82e5aca,,No links found
dec6fa5b-297a-4921-99f0-62434f52cd27,dc484b6b3b4cc82e915b6a01c324684dc6999286,"Elements of a violence prevention program for healthcare workers. U.S. Department of Labor, Occupational Safety and Health Administration.",https://www.semanticscholar.org/paper/dc484b6b3b4cc82e915b6a01c324684dc6999286,,No links found
3d1656b7-a5a0-4f75-bc7c-8b8e16f17c99,e1f54516607b27235724e6e833d4a8c56a2b840a,Sterile shelf life and expiration dating.,https://www.semanticscholar.org/paper/e1f54516607b27235724e6e833d4a8c56a2b840a,,No links found
8dbb9043-c55c-45f8-b2cd-c0f12ce04e94,e47b93d9d05a03d0b6aa265228c70fad2181fa07,"Contamination of bar soaps under ""in-use"" conditions.",https://www.semanticscholar.org/paper/e47b93d9d05a03d0b6aa265228c70fad2181fa07,,No links found
d2ebf1db-0022-4416-bcc4-6c40d4bef06b,e48436b8e89da92995f36bf7ccb13cf2f03c4daf,Use of the Hepatitis-B Vaccine and Infection with Hepatitis B and C among Orthopaedic Surgeons*,https://www.semanticscholar.org/paper/e48436b8e89da92995f36bf7ccb13cf2f03c4daf,https://doi.org/10.2106/00004623-199612000-00001,No links found
02851638-3833-494c-9a03-f953364275cf,e4f55837a44e3fdfc0fa02ea9efa5a0c71ccdf71,Practical infection control in dental laboratories.,https://www.semanticscholar.org/paper/e4f55837a44e3fdfc0fa02ea9efa5a0c71ccdf71,,No links found
344fd102-5b78-4d36-9421-5061c4e4fa60,f1f4ee9ec339d3aa65f9457e474d32a47cfea2cd,Transmission of the 263K scrapie strain by the dental route.,https://www.semanticscholar.org/paper/f1f4ee9ec339d3aa65f9457e474d32a47cfea2cd,https://doi.org/10.1099/0022-1317-80-11-3043,No links found
7a1ebacb-7da5-42fa-8eac-618f6a8f5007,f45951df515cc1b0da56b18f101ac11ff656bf71,Effect of powder-free latex examination glove use on airborne powder levels in a dental school clinic.,https://www.semanticscholar.org/paper/f45951df515cc1b0da56b18f101ac11ff656bf71,https://doi.org/10.1002/J.0022-0337.1999.63.11.TB03317.X,No links found
9309f013-3822-42dc-9ba2-3f3aa235e9f9,f5eb8599d5a72518c1f5c052e63a3ad4b9f4a871,Framework for program evaluation in public health,https://www.semanticscholar.org/paper/f5eb8599d5a72518c1f5c052e63a3ad4b9f4a871,,No links found
c14e0dd2-a6eb-4ebd-bd7b-a4f7ef6c2dea,f8f6668b248f836243f02d56c206518c34325674,Subjective effects of double gloves on surgical performance.,https://www.semanticscholar.org/paper/f8f6668b248f836243f02d56c206518c34325674,,No links found
5123097f-22de-4810-9205-96d8806e3a16,fe7a75b7e6abf4070ac4ed6c0362bf6605b0c18c,Dimensional stability of impression materials immersed in an iodophor disinfectant.,https://www.semanticscholar.org/paper/fe7a75b7e6abf4070ac4ed6c0362bf6605b0c18c,,No links found
c3a4b232-d83c-4607-9c9c-21e3db61aaae,00b2a7806bd3af3658098e2abed009a11026f609,"Hepatitis B immunization: vaccine types, efficacy, and indications for immunization.",https://www.semanticscholar.org/paper/00b2a7806bd3af3658098e2abed009a11026f609,,No links found
5db0ca4e-3f17-413d-802e-fea1cd44bf0e,59411d8a73412b31600452b0c66e68361c027d97,Horizontal transmission of hepatitis B virus infection to United States-born children of Hmong refugees.,https://www.semanticscholar.org/paper/59411d8a73412b31600452b0c66e68361c027d97,https://doi.org/10.1542/peds.89.2.269,No links found
322d2b79-852e-4e3e-a7a4-67071eac4220,924534be0cb3ed138e2e46e1310b70dc5eeaf836,Viral hepatitis and liver disease,https://www.semanticscholar.org/paper/924534be0cb3ed138e2e46e1310b70dc5eeaf836,,No links found
c69f7217-a94e-4ee1-827f-6df98afb0e92,0b6044cb3ed27185ce0f375d4d80cf0e525bed17,Experiments in Automatic Phrase Indexing For Document Retrieval: A Comparison of Syntactic and Non-Syntactic Methods,https://www.semanticscholar.org/paper/0b6044cb3ed27185ce0f375d4d80cf0e525bed17,,No links found
d1373dee-fc67-463a-84f6-1ae5cbd5e03b,54d47db19bb99177eed093d0dce2ab06bb8a26b9,Extraction of Index Words from Manuals,https://www.semanticscholar.org/paper/54d47db19bb99177eed093d0dce2ab06bb8a26b9,https://doi.org/10.5555/2856695.2856747,No links found
74132668-b9d7-451b-b59b-a6f4bc7a5055,807c1f19047f96083e13614f7ce20f2ac98c239a,C4.5: Programs for Machine Learning,https://www.semanticscholar.org/paper/807c1f19047f96083e13614f7ce20f2ac98c239a,,No links found
fde732d5-5e6a-442c-a9cd-80abaee727f1,814cf172298d11db0ac9b839440ed8f3db93e438,Arcing Classifiers,https://www.semanticscholar.org/paper/814cf172298d11db0ac9b839440ed8f3db93e438,,No links found
67520378-8b17-497b-b94f-bc3b321d0227,81dc8ca76afa41d2c49865068c46114178bdf558,The GENITOR Algorithm and Selection Pressure: Why Rank-Based Allocation of Reproductive Trials is Best,https://www.semanticscholar.org/paper/81dc8ca76afa41d2c49865068c46114178bdf558,,No links found
f45574c5-09ec-4285-9021-d0f54242ec9c,9e307772ef7b6257f4869a10508bfa9495d490c7,Development of a Document Summarization System for Effective Information Services,https://www.semanticscholar.org/paper/9e307772ef7b6257f4869a10508bfa9495d490c7,https://doi.org/10.5555/2856695.2856706,No links found
f66784d0-04a6-4108-9353-2779de2dc408,c3dd10311ea5c3cb0a200073853c48c462c0b602,Sample Surveys: The Field,https://www.semanticscholar.org/paper/c3dd10311ea5c3cb0a200073853c48c462c0b602,https://doi.org/10.1016/B0-08-043076-7%2F00496-4,No links found
e621329b-501c-4a94-ab43-9ab08347d0be,e3f1bcd14c1b9108918c998503c44b84bb25a714,Exporting phrases: a statistical analysis of topical language,https://www.semanticscholar.org/paper/e3f1bcd14c1b9108918c998503c44b84bb25a714,,No links found
d79d4b66-ded2-4652-bbbb-3d8f03ef7f8d,6627b45ff47a9089b1b104944641741d11029b17,Building a Knowledge Base from Parsed Definitions,https://www.semanticscholar.org/paper/6627b45ff47a9089b1b104944641741d11029b17,https://doi.org/10.1007/978-1-4615-3170-8_10,No links found
d0125f15-cba5-4b1b-ae72-053350d28e78,227a3ad1ed3e0eb068113d7f9737a7fc532a3e46,Hepatitis B virus infection in Honolulu students.,https://www.semanticscholar.org/paper/227a3ad1ed3e0eb068113d7f9737a7fc532a3e46,https://doi.org/10.1542/peds.92.4.574,No links found
704e51e9-783e-4e71-9650-e7ed7ddf4044,2e409e2f5467e6e0b4e5edea752d9e462b2652b7,Nosocomial hepatitis B associated with orthopedic surgery--Nova Scotia.,https://www.semanticscholar.org/paper/2e409e2f5467e6e0b4e5edea752d9e462b2652b7,,No links found
be9607ee-4ebe-4a64-8fcc-de92d4672b88,4390fb2f854a44044f927cf260fe68a1f21a7e9d,Antenatal hepatitis B screening - is there a need for a national policy?,https://www.semanticscholar.org/paper/4390fb2f854a44044f927cf260fe68a1f21a7e9d,,No links found
bde73d04-4ef5-472c-bce6-02a6862c8561,495bf46a09620c3bf27724431d377ceceefa612e,"A-DETERMINANT, Y-DETERMINANT AND D-DETERMINANT IN LIVER-CELLS OF HBSAG CARRIERS",https://www.semanticscholar.org/paper/495bf46a09620c3bf27724431d377ceceefa612e,,No links found
096fc902-c2a3-44f5-8b68-1be0b45fe638,59411d8a73412b31600452b0c66e68361c027d97,Horizontal transmission of hepatitis B virus infection to United States-born children of Hmong refugees.,https://www.semanticscholar.org/paper/59411d8a73412b31600452b0c66e68361c027d97,https://doi.org/10.1542/peds.89.2.269,No links found
e079167b-dd77-4834-a5a9-d903494f8d2f,5e95ebb16a2b80ababeed73f69fd591b82bbb95c,Transmission of hepatitis B to chimpanzees by hepatitis B surface antigen-positive saliva and semen,https://www.semanticscholar.org/paper/5e95ebb16a2b80ababeed73f69fd591b82bbb95c,https://doi.org/10.1128/iai.16.3.928-933.1977,No links found
8f7e839a-ee32-4917-b83e-0f92be91beee,6ead1e6f467d630f207d63ebbd2db94d69d892f1,Transmission of hepatitis B by a surgeon.,https://www.semanticscholar.org/paper/6ead1e6f467d630f207d63ebbd2db94d69d892f1,,No links found
b0d06ae4-f9a4-4bcf-ad0e-265e0c346f98,7a6296d8b4993358afb04ecfc58eb994d4d84130,Hepatitis B Vaccines in Clinical Practice,https://www.semanticscholar.org/paper/7a6296d8b4993358afb04ecfc58eb994d4d84130,,No links found
41ea865a-c32b-4084-95ab-10aa6820f0ff,896438bb3b1b74d5f56e5cbe84b13015ae9e9a68,Hepatitis B outbreak in a drug trials unit: investigation and recommendations.,https://www.semanticscholar.org/paper/896438bb3b1b74d5f56e5cbe84b13015ae9e9a68,,No links found
6cd11170-7b71-4895-a299-d0d1a1711702,89ce9b06b0e5cb047108a512f6ae2587983d732c,Hepatitis B transmission from dental personnel to patients: unfinished business.,https://www.semanticscholar.org/paper/89ce9b06b0e5cb047108a512f6ae2587983d732c,https://doi.org/10.7326/0003-4819-96-1-119_1,No links found
6ccecc79-8631-4350-9995-2f401b1ee5fa,924534be0cb3ed138e2e46e1310b70dc5eeaf836,Viral hepatitis and liver disease,https://www.semanticscholar.org/paper/924534be0cb3ed138e2e46e1310b70dc5eeaf836,,No links found
98a32a2d-15e8-49cc-868a-18a23c839531,9e22ac4feaab5550ae928e4cb01c2ecff92a98a1,Nosocomial viral hepatitis B. A cluster among staff with subsequent transmission to patients.,https://www.semanticscholar.org/paper/9e22ac4feaab5550ae928e4cb01c2ecff92a98a1,https://doi.org/10.7326/0003-4819-85-5-573,No links found
cdbf4abb-3672-4e47-bfc1-8147ff0c8953,ac21cc881c47be4da1266a7554a1020ceabd3760,Outbreaks of hepatitis B virus infection associated with infected surgical staff.,https://www.semanticscholar.org/paper/ac21cc881c47be4da1266a7554a1020ceabd3760,,No links found
ea57c342-2269-47da-94a8-293c338e47ff,ccbdf094c7de29ca71d467e87cbd5407d000554f,Recommendations for preventing transmission of infections among chronic hemodialysis patients,https://www.semanticscholar.org/paper/ccbdf094c7de29ca71d467e87cbd5407d000554f,,No links found
679c41d8-3493-4a77-911b-dc8e0c84e6eb,ea6bea125137f110b88a0e3c5e1a961d6b8037f8,Chronic glaucoma: a preventable cause of blindness.,https://www.semanticscholar.org/paper/ea6bea125137f110b88a0e3c5e1a961d6b8037f8,,No links found
6b9314ac-0e1e-44af-a710-12f0bb627c22,fea7cd7b4193aa28400c2f184f35334934d8669f,Hepatitis delta virus infection in Northern Ireland 1970-1989.,https://www.semanticscholar.org/paper/fea7cd7b4193aa28400c2f184f35334934d8669f,,No links found
14f1c21a-8539-4226-a85a-260400887e13,42ae701b811044ff534c968e7235c390d5ba22b6,Advances in hepatitis D virus biology and disease.,https://www.semanticscholar.org/paper/42ae701b811044ff534c968e7235c390d5ba22b6,,No links found
b9804849-13ce-4514-85f9-d2456245c059,49a3b4a2dd94611a7e0f16c54e875d3fe74f2bb5,Passive and active immunization against hepatitis B virus infection: optimal scheduling in healthy young adults.,https://www.semanticscholar.org/paper/49a3b4a2dd94611a7e0f16c54e875d3fe74f2bb5,,No links found
446a7c34-f362-46fc-b3b3-c6839cfaae97,4d4f68bb82b97ac030e2073ba8ba05f7830b6c1e,British Society of Gastroenterology,https://www.semanticscholar.org/paper/4d4f68bb82b97ac030e2073ba8ba05f7830b6c1e,https://doi.org/10.1016/S0016-5085%2864%2980069-X,No links found
be4e04b1-754b-491f-ac79-7933bd390cd8,80d82bc9d3dba3c6ec37428f507ad63b67030bf2,Perinatal transmission of hepatitis B virus and its prevention,https://www.semanticscholar.org/paper/80d82bc9d3dba3c6ec37428f507ad63b67030bf2,https://doi.org/10.1046/J.1440-1746.2000.02098.X,No links found
9b165d3c-3879-482b-912c-dff7a4e20bd7,b3ce251efb8acf14280fdbc812145a176069c2ed,Natural history of hepatitis B virus infection in children,https://www.semanticscholar.org/paper/b3ce251efb8acf14280fdbc812145a176069c2ed,https://doi.org/10.1046/J.1440-1746.2000.02096.X,No links found
ce2f9eb9-a8a1-4499-99fb-564a228143ad,bae8be50afa1ff48815efbc203525d62047d766d,Interferon: a meta-analysis of published studies in pediatric chronic hepatitis B.,https://www.semanticscholar.org/paper/bae8be50afa1ff48815efbc203525d62047d766d,,No links found
5539d306-b39e-4415-ac8e-932cd59b905f,cf90a5bcfa941ccf5ceda858253811f4587a4957,Hepatitis B-related sequelae. Prospective study in 1400 hepatitis B surface antigen-positive Alaska native carriers.,https://www.semanticscholar.org/paper/cf90a5bcfa941ccf5ceda858253811f4587a4957,https://doi.org/10.1001/ARCHINTE.150.5.1051,No links found
0f818515-6e46-4416-8c79-231095509431,d9d42054a891ef8e1398b793f060f2605c5bf853,Diagnosis of acute and chronic hepatitis C,https://www.semanticscholar.org/paper/d9d42054a891ef8e1398b793f060f2605c5bf853,,No links found
4b8675fb-fb00-44c1-9a27-d9f70d509d27,e18b5dfd17cf1f3bc7d64906df8971f80c46bb8b,Pathology of the Liver,https://www.semanticscholar.org/paper/e18b5dfd17cf1f3bc7d64906df8971f80c46bb8b,,No links found
42e97d52-4f33-4539-a374-2904b3bb3b9e,fc2f9f7c4e651a0925210df8f82fd59fb0028fc6,Acute and chronic viral hepatitis.,https://www.semanticscholar.org/paper/fc2f9f7c4e651a0925210df8f82fd59fb0028fc6,,No links found
ff8682a1-b478-4145-8d5e-db72246b243b,807c1f19047f96083e13614f7ce20f2ac98c239a,C4.5: Programs for Machine Learning,https://www.semanticscholar.org/paper/807c1f19047f96083e13614f7ce20f2ac98c239a,,No links found
7051905d-d04c-48ea-a10e-ed69e9b553c2,1066ac8a2639b074d558fd8a30f80f8d2c9c1bab,Factors determining the performance of indexing systems,https://www.semanticscholar.org/paper/1066ac8a2639b074d558fd8a30f80f8d2c9c1bab,,No links found
b5f27597-cf94-4099-90b7-bb610a9d5c3b,5e59e9089c49078ad2d4e564600fd86e65beedbc,Distinguished usage,https://www.semanticscholar.org/paper/5e59e9089c49078ad2d4e564600fd86e65beedbc,,No links found
b0763b11-af68-4906-ab51-938fbc1f1f0a,81e3b759746f0382af8ef6247adb6f4f31394e6f,A Simple Syntactic Approach for the Generation of Indexing Phrases,https://www.semanticscholar.org/paper/81e3b759746f0382af8ef6247adb6f4f31394e6f,,No links found
da14b43c-6dfb-4d98-8dba-7d8d3ce7537e,00b2a7806bd3af3658098e2abed009a11026f609,"Hepatitis B immunization: vaccine types, efficacy, and indications for immunization.",https://www.semanticscholar.org/paper/00b2a7806bd3af3658098e2abed009a11026f609,,No links found
a3668037-d5ce-42e0-80e1-3adaba0cf4f9,0e94f302b41d654b6c0e69603c9a73fbe11fba21,Recommendations for prevention and control of hepatitis C virus (HCV) infection and HCV-related chronic disease,https://www.semanticscholar.org/paper/0e94f302b41d654b6c0e69603c9a73fbe11fba21,https://doi.org/10.1037/e547602006-001,No links found
d198ca14-d1b2-4908-bd70-b6d05f941c03,23a5e8887df950ef4bdd130cbef6eb5d4a768945,Hepatitis C virus infection decreases the effective antibody response to hepatitis B vaccine in hemodialysis patients.,https://www.semanticscholar.org/paper/23a5e8887df950ef4bdd130cbef6eb5d4a768945,,No links found
bc4f0e24-08e2-48d2-9a5d-0ecf02f45a4f,2ae22f40c7ff48cdc8ed1095420db5df4e5805da,Virological features of hepatitis C virus infection in hemodialysis patients,https://www.semanticscholar.org/paper/2ae22f40c7ff48cdc8ed1095420db5df4e5805da,https://doi.org/10.1128/jcm.31.11.2913-2917.1993,No links found
631f9e50-bc94-43aa-8255-606262456964,2d40cdf422ee370ca6d016262c58de54cb6a89e6,Immunogenicity of a recombinant hepatitis B vaccine in haemodialysis patients.,https://www.semanticscholar.org/paper/2d40cdf422ee370ca6d016262c58de54cb6a89e6,,No links found
eb2cdf79-ec1f-42cd-8167-6a39035fe29c,4ad6dae4e211403fcca6880c00fe0d6391f7c4d7,Patterns of hepatitis C viremia in patients receiving hemodialysis.,https://www.semanticscholar.org/paper/4ad6dae4e211403fcca6880c00fe0d6391f7c4d7,,No links found
065a7c1d-b6b8-4a69-bb17-e7d3582f5999,5768258072bc784435192e58014b39ad699c7a41,Hepatitis B vaccination of renal transplant and hemodialysis patients.,https://www.semanticscholar.org/paper/5768258072bc784435192e58014b39ad699c7a41,,No links found
f19d523d-d841-4607-8ce1-fe2a75b94f1a,672b9653d6e94be95eb769e0be7aa52da14d2caa,Detection of hepatitis C virus RNA in hemodialysis patients.,https://www.semanticscholar.org/paper/672b9653d6e94be95eb769e0be7aa52da14d2caa,,No links found
be9a4c9f-612d-481a-a83a-158317e33e01,6903e17b4e865fca7e37ab95d977d3fa2d435bf1,Hepatitis C infection in a pediatric dialysis population.,https://www.semanticscholar.org/paper/6903e17b4e865fca7e37ab95d977d3fa2d435bf1,https://doi.org/10.1542/peds.89.4.707,No links found
8ec9087e-c027-4f69-a6b7-87bcc8d3b449,75cd1b1847b70ce95dc84cc557b114f1fa79dfe1,MedWatch: the FDA medical products reporting program.,https://www.semanticscholar.org/paper/75cd1b1847b70ce95dc84cc557b114f1fa79dfe1,,No links found
2195d0c1-accb-4efb-b5e6-68d8b0b7169d,77f029d28f14ff3b2a66605ff0e6b1e479c95830,Epidemiological analysis of the significance of low-positive test results for antibody to hepatitis B surface and core antigens,https://www.semanticscholar.org/paper/77f029d28f14ff3b2a66605ff0e6b1e479c95830,https://doi.org/10.1128/jcm.19.4.521-525.1984,No links found
b8de0f39-2086-4d32-97bd-46c65590656e,7d6a2231cd61063ffb7f9adc4052f5df8ee51f54,Comparison of two quantitative hepatitis C virus reverse transcriptase PCR assays,https://www.semanticscholar.org/paper/7d6a2231cd61063ffb7f9adc4052f5df8ee51f54,https://doi.org/10.1128/jcm.34.2.261-264.1996,No links found
88aab0d5-2f4c-45fc-9403-bd5f72eb1e6d,9b161889175af0a4ff6b5575b8b1e1365651f94a,Is hepatitis C virus-RNA detection by nested polymerase chain reaction clinically relevant in hemodialysis patients?,https://www.semanticscholar.org/paper/9b161889175af0a4ff6b5575b8b1e1365651f94a,,No links found
06eca824-bfac-4e48-ae39-64c74e21499b,a93f51697230acbdad0e8a74e21c7d56d876f6ab,Complete seroconversion after vaccination against hepatitis B virus in hemodialysis patients.,https://www.semanticscholar.org/paper/a93f51697230acbdad0e8a74e21c7d56d876f6ab,,No links found
b92c7ec1-2e94-4194-9967-ea8343712d4b,b791a660c76030826406d184f2de2499167f9389,Pseudo-outbreak of Enterococcus durans infections and colonization associated with introduction of an automated identification system software update,https://www.semanticscholar.org/paper/b791a660c76030826406d184f2de2499167f9389,https://doi.org/10.1128/JCM.34.11.2685-2687.1996,No links found
2baba679-44fd-4dcf-8922-77b9851c9a71,c95cd8af530c2a1d593f1c4ab60edb65ac224906,Successful vaccination with intradermal hepatitis B vaccine in hemodialysis patients previously nonresponsive to intramuscular hepatitis B vaccine.,https://www.semanticscholar.org/paper/c95cd8af530c2a1d593f1c4ab60edb65ac224906,,No links found
